Activity ID,Activity Date,Activity Name,Activity Type,Activity Description,Elapsed Time,Distance,Relative Effort,Commute,Activity Gear,Filename
512973371,"Mar 10, 2016, 1:13:59 AM",Crystal City Parking Garage Crit. Nutrition plan...Brown ale & kettle chips,Ride,,3423,0,,FALSE,Giant Propel Advanced 1,activities/565105427.fit.gz
513518092,"Mar 10, 2016, 6:48:11 PM",Falling but learning new MTB skills,Ride,,4551,16.97,15,FALSE,Highball,activities/565652473.fit.gz
514469847,"Mar 11, 2016, 10:25:09 PM",Getting 95 traffic out my system,Run,,2500,8.81,42,FALSE,,activities/566615988.fit.gz
515227297,"Mar 12, 2016, 5:30:12 PM",3 x Bethany Mountain on busted right pedal. Then low LT efforts on the flats,Ride,,9766,68.09,78,FALSE,Giant Propel Advanced 1,activities/567389727.fit.gz
515335522,"Mar 12, 2016, 9:22:59 PM",Quick transition run to YMCA to swim,Run,,1083,3.8,24,FALSE,,activities/567501651.fit.gz
515335539,"Mar 12, 2016, 9:49:47 PM",Easy recovery swim with Sara focusing on form,Swim,,1826,"1,097",,FALSE,,activities/567501674.fit.gz
516123445,"Mar 13, 2016, 2:32:13 PM","Sleeping Giant Trail Run. Climb 1=Oxygen Debt, Climb 2=Hammertime",Run,,5080,9.01,88,FALSE,Brooks Ghost,activities/568322836.fit.gz
518502596,"Mar 16, 2016, 1:08:11 PM",Taking the MTB on a walk to work,Ride,,2725,18.08,16,FALSE,Highball,activities/570935811.fit.gz
518730625,"Mar 14, 2016, 9:53:17 PM",Working on Chef Will's stroke,Swim,,2391,732,,FALSE,,activities/571165399.fit.gz
518730646,"Mar 15, 2016, 8:49:32 PM",Stretching legs from long weekend,Run,,2421,7.38,20,FALSE,,activities/571165411.fit.gz
518734670,"Mar 9, 2016, 9:00:00 AM",Crit distance,Ride,,0,22.53,,FALSE,Kestrel Legend,
518947327,"Mar 16, 2016, 9:58:22 PM",Ripping home. 2x10' tempo->LT + 5' effort,Ride,,4498,32.67,34,FALSE,Highball,activities/571381018.fit.gz
519541583,"Mar 17, 2016, 5:24:55 PM",15x100 on 1:30 (5 WU + 10 strong) + 4x50 CD,Swim,,1696,"1,555",,FALSE,,activities/571976784.fit.gz
519550594,"Mar 17, 2016, 5:08:52 PM",Run to swim,Run,,3327,1.62,10,FALSE,,activities/571985940.tcx.gz
519826576,"Mar 17, 2016, 9:46:52 PM",Chasing Peyton on Hill Repeats,Run,,6980,10,54,FALSE,,activities/572263222.fit.gz
520525406,"Mar 18, 2016, 9:24:28 PM",Chill Lake Fairfax MTB Loop,Ride,"
",8150,40.3,28,FALSE,Highball,activities/572982424.fit.gz
522271208,"Mar 20, 2016, 1:13:36 PM",Finding that my left glute is messing up my stroke.  #cheeky,Swim,,3443,"2,286",,FALSE,,activities/574774128.fit.gz
522442824,"Mar 20, 2016, 7:16:46 PM",Consume 3 monster cupcakes then eat 3x10' tempo efforts,Ride,,4555,0,73,FALSE,Felt IA4,activities/574953998.fit.gz
523303663,"Mar 21, 2016, 9:59:07 PM",Exploring San Antonio.  River Walk is pretty,Run,,3037,9.98,57,FALSE,,activities/575825867.fit.gz
523311033,"Mar 21, 2016, 11:00:00 PM",Playing in outdoor hotel pool dodging spring breakers,Swim,,900,914,,FALSE,,
524229556,"Mar 22, 2016, 11:48:20 PM",Hilly transition run,Run,,1385,4.32,,FALSE,,activities/576768571.fit.gz
524229622,"Mar 22, 2016, 8:09:29 PM",Texas Hill Country. Earned my Spurs!,Ride,,12438,70.59,73,FALSE,Giant Propel Advanced 1,activities/576768572.fit.gz
524903804,"Mar 23, 2016, 5:22:12 PM",Seeing 4 historic Missions & battling south Texas wind,Ride,,6212,45.18,,FALSE,,activities/577451785.tcx.gz
527516750,"Mar 26, 2016, 5:13:49 PM",Using salty beach air to open up hamstring. No dice,Ride,,8009,59.63,51,FALSE,Giant Propel Advanced 1,activities/580123603.fit.gz
528589245,"Mar 27, 2016, 10:35:14 PM","Strong NE wind, sand bars, & salty bliss",Run,,4445,10.63,24,FALSE,,activities/581233925.fit.gz
529795550,"Mar 29, 2016, 12:24:49 PM",Thank you wind for not making me late to work,Ride,,2267,18.06,35,FALSE,Giant Propel Advanced 1,activities/582469043.fit.gz
530311146,"Mar 29, 2016, 10:25:31 PM",6 over gearing efforts to push through the wind,Ride,,3665,28.24,28,FALSE,Giant Propel Advanced 1,activities/582990720.fit.gz
531367759,"Mar 30, 2016, 4:38:09 PM",Seeking my stroke: 30% of workout was single arm drill,Swim,,2076,"1,463",,FALSE,,activities/584073400.fit.gz
531367770,"Mar 30, 2016, 10:30:25 PM",Taking the dog for a scamper,Run,,1012,2.74,6,FALSE,,activities/584073411.fit.gz
531369841,"Mar 30, 2016, 4:29:12 PM",Run to High School Pool,Run,,3271,1.65,12,FALSE,,activities/584075608.tcx.gz
531884169,"Mar 31, 2016, 4:53:38 PM",Burning off stress: WU + 3 mile tempo RPE + CD,Run,,2292,8.05,73,FALSE,,activities/584598953.fit.gz
532930020,"Apr 1, 2016, 8:38:11 PM",Lots of tempo with wind,Ride,,7720,65.94,61,FALSE,Felt IA4,activities/585667317.fit.gz
533991720,"Apr 2, 2016, 8:54:41 PM",Marsh Creek MTB with the Philly Boys,Ride,,8256,30.1,45,FALSE,Highball,activities/586761085.fit.gz
535024607,"Apr 3, 2016, 5:36:45 PM",Quick trail run,Run,,2099,2.85,6,FALSE,Brooks Ghost,activities/587841337.fit.gz
535024658,"Apr 3, 2016, 6:23:06 PM",Introducing Ed to MTB after night of shots,Ride,,4373,17.06,23,FALSE,Highball,activities/587841383.fit.gz
536796807,"Apr 5, 2016, 6:21:48 PM",Main Set: Drop 1 second per 100.  Then 10x100 form focused,Swim,,2391,"2,103",,FALSE,,activities/589644423.fit.gz
536869869,"Apr 5, 2016, 6:12:22 PM",Run to High School Pool,Run,,4011,1.78,10,FALSE,Brooks Ghost,activities/589717445.tcx.gz
537713526,"Apr 6, 2016, 6:00:24 PM",Tempo Wave 10K: 1 mile WU + 4x(.5 @ fast tempo + .5 @ easy tempo + 1 mile CD),Run,,3102,9.98,82,FALSE,,activities/590573985.fit.gz
537893587,"Apr 6, 2016, 9:24:38 PM",Mountain Biking through wild flowers,Ride,,6934,32.58,32,FALSE,Highball,activities/590755343.fit.gz
539608483,"Apr 8, 2016, 10:30:16 PM",Trainer Ride.  Open up legs for short run,Ride,,3049,0,40,FALSE,Felt IA4,activities/592493224.fit.gz
539608494,"Apr 8, 2016, 11:32:09 PM",Transition run on the beach. What a sunset!,Run,,1811,5.32,30,FALSE,Brooks Ghost,activities/592493237.fit.gz
540268627,"Apr 9, 2016, 2:50:16 PM","Quicksand, jetty, and crazy wind beach run",Run,,4174,9.83,,FALSE,Brooks Ghost,activities/593171776.fit.gz
542628817,"Apr 11, 2016, 8:24:34 PM",Beach transition run.  Get faster each mile,Run,,1985,6.45,,FALSE,Brooks Ghost,activities/595593394.fit.gz
542629238,"Apr 11, 2016, 7:14:17 PM",Couple tempo efforts on trainer,Ride,,3696,0,28,FALSE,Felt IA4,activities/595593837.fit.gz
543786037,"Apr 13, 2016, 4:00:00 AM",Rehabbing the bicep.  Still torn.,Swim,,1800,"1,829",,FALSE,,
544180689,"Apr 13, 2016, 2:13:24 PM",Easy ride to work,Ride,,2509,18.01,15,FALSE,Giant Propel Advanced 1,activities/597190335.fit.gz
544680634,"Apr 13, 2016, 10:16:26 PM","Stomps, over gearing, straight slayin' watts",Ride,,4896,38.82,43,FALSE,Giant Propel Advanced 1,activities/597698670.fit.gz
545701890,"Apr 15, 2016, 12:09:55 AM",Moonlight illuminated trail run,Run,,3057,9.66,,FALSE,Brooks Ghost,activities/545701890.gpx
546092660,"Apr 15, 2016, 1:16:10 PM",Recovery ride to work,Ride,,2672,17.99,15,FALSE,Giant Propel Advanced 1,activities/599146221.fit.gz
546481212,"Apr 15, 2016, 10:54:11 PM",Dreaming of pizza,Ride,,4747,35.39,30,FALSE,Giant Propel Advanced 1,activities/599545053.fit.gz
547242358,"Apr 16, 2016, 2:01:04 PM",50m @ Wilson.  Bicep still on the rebound,Swim,,2596,"2,300",,FALSE,,activities/600337577.fit.gz
547402391,"Apr 16, 2016, 6:53:16 PM",Working on my cornering game,Ride,,4862,28.19,24,FALSE,Highball,activities/600502956.fit.gz
548551265,"Apr 17, 2016, 4:47:30 PM",Trail transition run.  Mountain Goat style!,Run,,1431,4.07,,FALSE,,activities/601703161.fit.gz
548551356,"Apr 17, 2016, 1:28:22 PM",Hilly training ride with the Sherpettes & Justin,Ride,,10955,61.43,51,FALSE,,activities/601703151.fit.gz
549787646,"Apr 18, 2016, 12:59:44 PM",Active Recovery work commuting,Ride,,38464,47.22,78,FALSE,,activities/602973894.tcx.gz
551498696,"Apr 20, 2016, 3:44:14 PM",2 x 10' napalm efforts on the WOD,Ride,,6363,32.46,58,FALSE,Felt IA4,activities/604764571.fit.gz
551863348,"Apr 20, 2016, 9:24:36 PM",Nuke the quads will hill repeats,Run,,2598,8.43,47,FALSE,,activities/605145031.fit.gz
551872161,"Apr 19, 2016, 5:20:50 PM",Easy run to pool,Run,,3800,1.6,5,FALSE,,activities/605154122.tcx.gz
551874165,"Apr 19, 2016, 8:00:00 PM","Recovery swim: kick, drill, stroke",Swim,,1500,"1,372",,FALSE,,
552635434,"Apr 21, 2016, 5:36:49 PM",Pace work for lunch,Swim,,1988,"1,829",,FALSE,,activities/606052622.fit.gz
552657700,"Apr 21, 2016, 5:26:36 PM",Easy run to pool,Run,,3446,1.76,10,FALSE,,activities/606084479.tcx.gz
552951790,"Apr 21, 2016, 10:48:11 PM",MTB skill focused night,Ride,,5965,29.35,17,FALSE,Highball,activities/606378935.fit.gz
553690712,"Apr 22, 2016, 8:18:17 PM",Great ride with my guests from Florida,Ride,,4621,31.27,,FALSE,Giant Propel Advanced 1,activities/607137986.fit.gz
554411012,"Apr 23, 2016, 2:22:34 PM",Pushing Chris the last 2 miles,Run,,4948,16.57,148,FALSE,Brooks Ghost,activities/607881246.fit.gz
555878481,"Apr 24, 2016, 4:47:59 PM",Speed Goat Trail Transition Run,Run,,1093,3.47,,FALSE,Brooks Ghost,activities/609406286.fit.gz
555882170,"Apr 24, 2016, 1:12:54 PM",Speed Sherpa 2016 Training Camp Ride,Ride,,12227,81.55,122,FALSE,Giant Propel Advanced 1,activities/609410020.fit.gz
556730138,"Apr 25, 2016, 5:43:39 PM",Left my keys on the trail,Run,,805,2.1,4,FALSE,Brooks Ghost,activities/610291342.fit.gz
556730161,"Apr 25, 2016, 6:01:48 PM",Kennedy Peak Recovery Ride,Ride,,3153,9.77,13,FALSE,,activities/610291353.fit.gz
557254628,"Apr 26, 2016, 11:16:57 AM",Shenandoah recovery gravel MTB ,Ride,,4538,25.99,19,FALSE,Highball,activities/610829925.fit.gz
561434986,"Apr 30, 2016, 10:14:33 PM",Maybe I can race...bike feels ok but the run?,Ride,,1787,13.03,10,FALSE,Highball,activities/615109220.fit.gz
561434998,"Apr 30, 2016, 10:46:30 PM",Nope..can't breathe. No race :(,Run,,302,1.04,4,FALSE,Brooks Ghost,activities/615109232.fit.gz
563502798,"May 2, 2016, 9:46:20 PM",Super soft sand run to kill the sickness,Run,,1885,5.74,,FALSE,Brooks Ghost,activities/563502798.gpx
566772815,"May 5, 2016, 9:18:25 PM",First ride back...that was tough,Ride,,4342,0,50,FALSE,Felt IA4,activities/620597829.fit.gz
567750602,"May 6, 2016, 10:39:13 PM",AeT yeah you know me...and a few efforts,Ride,,3844,0,60,FALSE,Felt IA4,activities/621605130.fit.gz
568728459,"May 7, 2016, 3:44:32 PM","2 x Anglers & Great Falls. Big ring everything. broken spoke, flat, walk home. Dark day",Ride,,12551,82.72,80,FALSE,Giant Propel Advanced 1,activities/622615487.fit.gz
568947485,"May 7, 2016, 11:02:43 PM",First swim in 2 weeks. Better but arms still jammed up,Swim,,2623,"2,103",,FALSE,,activities/622847209.fit.gz
570099158,"May 8, 2016, 10:07:57 PM",Smooth run to Cape May Ferry and back. Too many brunch Bellinis,Run,,2234,8.05,,FALSE,,activities/624056252.fit.gz
572167017,"May 10, 2016, 11:04:00 PM",Sunset Beach Run after building new deck.  Ahh my hamstrings!,Run,,2931,7.55,,FALSE,,activities/626172202.fit.gz
573219624,"May 12, 2016, 12:46:58 AM",Recovery spin watching Olympic previews. #rio2016,Ride,,2761,0,28,FALSE,Felt IA4,activities/627249447.fit.gz
573653296,"May 12, 2016, 1:34:01 PM",Commute to work on knobby tires,Ride,,2678,19.5,19,FALSE,Highball,activities/627693417.fit.gz
574178153,"May 12, 2016, 9:41:48 PM",Attacking roadies on MTB commute home,Ride,,3884,27.79,31,FALSE,Highball,activities/628235130.fit.gz
574692082,"May 13, 2016, 1:10:40 PM",Metro commuter challenges...keep riding!,Ride,,2671,19.24,14,FALSE,Highball,activities/628763957.fit.gz
575992854,"May 13, 2016, 6:18:19 PM",Commute home between the storns,Ride,,2735,19.19,18,FALSE,Highball,activities/630110018.fit.gz
575997395,"May 14, 2016, 6:30:00 PM",Broke my right power pedal...again.  Something about riding in CT.,Ride,,3900,32.18,,FALSE,Felt IA4,
576225935,"May 14, 2016, 8:49:43 PM",Short Rehab Swim.  Still busted,Swim,,1542,"1,372",,FALSE,,activities/630353550.fit.gz
576225968,"May 14, 2016, 9:59:02 PM",2 x Sleeping Giant Mountain.  2nd time faster.  Ouch,Run,,4393,11.69,90,FALSE,Brooks Ghost,activities/630353564.fit.gz
577213729,"May 15, 2016, 5:56:31 PM",Progressive Transition Run,Run,,853,3.26,,FALSE,Brooks Ghost,activities/631384804.fit.gz
577214444,"May 15, 2016, 3:35:00 PM","No power meter, no problem.  Low tempo RPE.",Ride,,7846,68.07,,FALSE,Felt IA4,activities/631385467.fit.gz
578469559,"May 16, 2016, 9:31:12 PM",Recovery MTB. Channeling my inner Titus,Ride,,3844,23.37,,FALSE,Highball,activities/632690320.fit.gz
580277055,"May 18, 2016, 4:50:39 PM",Quick swim...getting better,Swim,,1602,"1,372",,FALSE,,activities/634541137.fit.gz
580289349,"May 18, 2016, 4:42:14 PM",Run to High School Pool,Run,,2927,1.59,,FALSE,,activities/634553718.tcx.gz
580494462,"May 18, 2016, 7:56:57 PM",Easy peasy recovery'ish run,Run,,2406,8.05,,FALSE,,activities/634762316.fit.gz
581616679,"May 19, 2016, 6:46:12 PM",Carving the lip for Titus & slayin' slick rock gardens for Kur,Ride,,15697,81.08,67,FALSE,Highball,activities/635918224.fit.gz
584792324,"May 22, 2016, 3:44:47 PM",Surfing with dolphins in 52 degree water.  Awesome!,Swim,,2762,"1,012",,FALSE,,activities/639218760.fit.gz
584792354,"May 22, 2016, 6:23:03 PM",Beach run in the rain,Run,,3578,8.08,30,FALSE,Brooks Ghost,activities/639218787.fit.gz
586027558,"May 24, 2016, 12:04:21 AM",Hello Colorado.  Thank you for the kick ass MTB,Ride,,6785,17.77,46,FALSE,,activities/640485273.fit.gz
587061055,"May 24, 2016, 11:33:10 PM",Strong gravel transition run @ altitude,Run,,908,3.27,,FALSE,Brooks Ghost,activities/641540434.fit.gz
587061070,"May 24, 2016, 9:36:54 PM",Enchanted Forest MTB + 7 mile Monster Climb,Ride,,6326,26.12,35,FALSE,,activities/641540432.fit.gz
587062361,"May 24, 2016, 2:30:00 PM",Altitude Sickness.  Had to stop.,Swim,,1200,"1,006",,FALSE,,
588012750,"May 25, 2016, 6:48:56 PM",EPIC trail run.  Red Rocks to Dinosaur Ridge.  Total beat down,Run,,7100,12.91,,FALSE,Brooks Ghost,activities/642518305.fit.gz
588195939,"May 25, 2016, 11:50:26 PM",North Table Mountain.  Final Ride in CO,Ride,,3220,16.8,41,FALSE,,activities/642706894.fit.gz
590103347,"May 27, 2016, 9:13:53 PM",Speed work: Chasing 6 year old nephew on his bike,Run,,2517,8.06,,FALSE,,activities/644670317.fit.gz
591250335,"May 28, 2016, 9:21:12 PM",Sliced Tire. Abrupt  end  to a fast ride,Ride,,1538,15.13,10,FALSE,Felt IA4,activities/645851841.fit.gz
591328381,"May 28, 2016, 11:08:03 PM",Easy beach run during sunset,Run,,2623,7.22,,FALSE,Brooks Ghost,activities/645932540.fit.gz
592101153,"May 29, 2016, 1:20:36 PM",11 speed wheel on 10 speed...don't recommend it #slippage,Ride,,9883,62.71,,FALSE,Felt IA4,activities/646729995.fit.gz
592329306,"May 29, 2016, 6:18:23 PM",Dodging fishermen & horseshoe crabs,Swim,,908,644,,FALSE,,activities/646974742.fit.gz
593451571,"May 30, 2016, 8:39:19 PM",Swim at Von Savage with Sara,Swim,,2848,"1,829",,FALSE,,activities/648141738.fit.gz
597086018,"Jun 3, 2016, 11:44:33 AM",Easy MTB to open up busted left leg,Ride,,6594,29.1,17,FALSE,Highball,activities/651862310.fit.gz
598574564,"Jun 4, 2016, 4:28:02 PM",Pre-riding Raleigh 70.3 with my athletes,Ride,,5443,34.53,49,FALSE,,activities/653402530.fit.gz
601072292,"Jun 6, 2016, 11:59:58 PM",Just in case today's MRI is negative. Dialing in sprint race legs,Ride,,3195,27.89,61,FALSE,Felt IA4,activities/655980781.fit.gz
602217464,"Jun 7, 2016, 11:56:43 PM","MTB rides flush fluid from the knee, right?",Ride,,4392,25.15,26,FALSE,Highball,activities/657154344.fit.gz
604452803,"Jun 8, 2016, 8:11:54 PM",Recovery swim with one-legged flip turns,Swim,,2158,"1,463",,FALSE,,activities/659513736.fit.gz
604452825,"Jun 9, 2016, 2:16:44 PM",Easy commute,Ride,,29634,36.79,34,FALSE,,activities/659513741.fit.gz
605386307,"Jun 10, 2016, 9:55:42 PM",Bruised tibia & strained ligaments make running pretty painful. Sunday's race may not happen,Run,,1180,3.23,,FALSE,,activities/660481264.fit.gz
605837004,"Jun 11, 2016, 1:19:08 PM",Sherpa'ing Sara & Biondi through their openers,Ride,,1590,7.89,6,FALSE,Felt IA4,activities/660956011.fit.gz
609516208,"Jun 12, 2016, 12:32:39 PM",Escape the Cape Sprint Tri: Bike,Ride,,1968,19.43,,FALSE,,activities/664786124.fit.gz
609613809,"Jun 14, 2016, 11:16:35 PM",Massive pizza consumption then tons of log hops. Wrong order. Burp!,Ride,,7221,34.91,25,FALSE,Highball,activities/664886765.fit.gz
611434616,"Jun 16, 2016, 2:08:53 PM",Commute with wonky knee,Ride,,25970,40.68,,FALSE,Giant Propel Advanced 1,activities/666776557.fit.gz
612355243,"Jun 17, 2016, 9:34:04 PM",Happy Hour,Ride,,4420,35.41,,FALSE,Giant Propel Advanced 1,activities/667742610.fit.gz
613431643,"Jun 18, 2016, 6:59:00 PM",5 x Hains Point Laps then ride home,Ride,,9710,72.71,136,FALSE,Felt IA4,activities/668862432.fit.gz
613542017,"Jun 18, 2016, 5:20:02 PM",50m Hains Point Outdoor Pool.  Pretty Sweet,Swim,,2711,"2,000",,FALSE,,activities/668978985.fit.gz
613542094,"Jun 12, 2016, 12:20:51 PM",Escape the Cape Sprint Tri: Swim,Swim,,506,731,,FALSE,,activities/668978964.fit.gz
613542106,"Jun 12, 2016, 1:06:07 PM",Escape the Cape Sprint Tri: Run,Run,,1308,4.96,,FALSE,,activities/668978971.fit.gz
614708083,"Jun 19, 2016, 8:22:44 PM",Steezy MTB Session,Ride,,10058,49.96,40,FALSE,Highball,activities/670207214.fit.gz
615576124,"Jun 20, 2016, 9:51:22 PM",Easy commute home,Ride,,4816,35.5,27,FALSE,Giant Propel Advanced 1,activities/671133159.fit.gz
617170224,"Jun 21, 2016, 3:10:24 PM",Swim clinic with Peyton & Sara,Swim,,3682,"1,500",,FALSE,,activities/672784442.fit.gz
617170276,"Jun 21, 2016, 4:48:39 PM",MTB with Josh.  Pseudo business meeting,Ride,,5720,14.33,15,FALSE,Highball,activities/672784460.fit.gz
619845884,"Jun 24, 2016, 10:18:06 PM",Sprinted out of the water...too many fins!!! Thankfully they were dolphins,Swim,,1487,764,,FALSE,,activities/675600911.fit.gz
619845901,"Jun 25, 2016, 12:36:09 AM",First run in weeks. Too soon. Back to healing,Run,,1955,5.88,,FALSE,,activities/675600921.fit.gz
620380983,"Jun 25, 2016, 1:59:16 PM",30' tempo. Puncture. Game over. Come on Cape May...toss me a break!,Ride,,2164,19.82,,FALSE,Felt IA4,activities/676160339.fit.gz
621760541,"Jun 26, 2016, 12:11:55 PM",Ocean swim with Cape May Beach Patrol.  3 x Houses,Swim,,3119,"2,197",,FALSE,,activities/677618338.fit.gz
621763446,"Jun 26, 2016, 3:30:00 PM",Soft sand running in wetsuit between swim sets,Run,,600,1.61,,FALSE,,
622145535,"Jun 27, 2016, 12:34:14 AM",Need to stop drinking wine and eating before beach runs. Booze loosened the leg though!,Run,,3242,7.08,,FALSE,Brooks Ghost,activities/678021427.fit.gz
622148012,"Jun 26, 2016, 6:56:29 PM",3rd Floor Deck is my pain lab.  60' of fun...coming to my athletes soon :),Ride,,3667,0,,FALSE,Felt IA4,activities/678023948.tcx.gz
625040596,"Jun 29, 2016, 8:40:41 PM",Trying to beat sinus infection w easy MTB joy ride,Ride,,5167,28.52,18,FALSE,Highball,activities/681028255.fit.gz
626059251,"Jun 30, 2016, 6:35:38 PM",Titus's first day back on MTB. Antibiotics couldn't stop the fun,Ride,,13021,49.97,57,FALSE,Highball,activities/682813189.fit.gz
627867498,"Jul 1, 2016, 10:14:55 PM",15' brutal wet/soft sand. Bonk. 15' run on road w eyes closed dreaming of dorittos,Run,,2229,5.48,,FALSE,Brooks Ghost,activities/686095892.fit.gz
627867523,"Jul 2, 2016, 1:08:57 PM",Dolphins jumping & spinning were a highlight,Swim,,3157,"2,016",,FALSE,,activities/686095932.fit.gz
628001436,"Jul 2, 2016, 8:43:27 PM",Tempo ride around Cape May,Ride,,5413,48.36,69,FALSE,Felt IA4,activities/686336078.fit.gz
628018071,"Jul 2, 2016, 10:30:41 PM",Quick transition run along the bay,Run,,792,3.23,,FALSE,,activities/686370679.fit.gz
628775034,"Jul 3, 2016, 1:07:29 PM",Coaching Sara & Dave B on how to deal with tough ocean conditions,Swim,,2601,978,,FALSE,,activities/687693711.fit.gz
629087200,"Jul 3, 2016, 6:15:08 PM",Beach run...loving it,Run,,2672,8.06,,FALSE,Brooks Ghost,activities/688150175.fit.gz
630413896,"Jul 4, 2016, 5:00:00 PM",Got my toes nibbled on in the ocean.  #BaitFish,Swim,,1200,"1,372",,FALSE,,
630417499,"Jul 4, 2016, 5:14:42 PM",Easy run from Ocean after swim & Bill's Pancake House,Run,,4868,12.91,,FALSE,,activities/690502613.fit.gz
631397009,"Jul 5, 2016, 1:28:46 PM",Long boarding at the Cove,Surfing,,4001,1.47,,,,activities/692192904.fit.gz
632534470,"Jul 6, 2016, 9:07:08 PM",Commute. Nothing in the tank. Too much 'merica last weekend,Ride,,5336,40.21,40,FALSE,Giant Propel Advanced 1,activities/694168621.fit.gz
633092833,"Jul 7, 2016, 1:11:52 PM",Dancing on my ride into work,Ride,,2377,17.96,15,FALSE,Giant Propel Advanced 1,activities/695251575.fit.gz
633642687,"Jul 7, 2016, 9:47:20 PM",Hammer home. Lots of short LT+ efforts w shorter rest,Ride,,5029,38.63,81,FALSE,Giant Propel Advanced 1,activities/696126291.fit.gz
635676699,"Jul 9, 2016, 6:10:17 PM",Outdoors @ Hains Point 50m pool with other Speed Sherpas,Swim,,3447,"2,650",,FALSE,,activities/699861541.fit.gz
635676711,"Jul 9, 2016, 10:29:33 PM",Smooth transition run,Run,,1024,3.57,,FALSE,,activities/699861553.fit.gz
635683597,"Jul 9, 2016, 7:42:11 PM",Aerobic ride from pool. Saw bald eagle fly over Potomac!,Ride,,8926,50.15,44,FALSE,Felt IA4,activities/699875570.fit.gz
636989165,"Jul 10, 2016, 9:11:38 PM",Solid MTB. Cleared all obstacles. ,Ride,,8848,43.53,34,FALSE,Highball,activities/702059142.fit.gz
637009456,"Jul 10, 2016, 11:57:03 PM",Transition Run. Focus on shorter strides & cadence,Run,,1203,4.34,,FALSE,,activities/637009456.gpx
639083561,"Jul 12, 2016, 10:59:13 PM",Taking the bike for a dirt walk,Ride,,4538,26.17,13,FALSE,Highball,activities/705098827.fit.gz
639628788,"Jul 13, 2016, 2:10:12 PM",Counting Pokemon players on short commute. 8!!!,Ride,,2375,17.97,13,FALSE,Giant Propel Advanced 1,activities/705681162.fit.gz
639948217,"Jul 13, 2016, 6:17:07 PM",Lunch swim: 800 WU + 400 IM + 800 STRONG + CD,Swim,,2129,"2,012",,FALSE,,activities/706017672.fit.gz
639954300,"Jul 13, 2016, 6:06:34 PM",Run to High School Pool,Run,,3839,1.63,,FALSE,,activities/706023890.tcx.gz
640159039,"Jul 13, 2016, 10:42:02 PM",12 x stomps @ 150-200% FTP.  Aerobic in between avoiding Pokemon peeps!,Ride,"

",4898,36.08,32,FALSE,Giant Propel Advanced 1,activities/706243141.fit.gz
641037232,"Jul 14, 2016, 4:37:16 PM",Garmin is generous with distance when I swim outdoor long course,Swim,,2611,"1,200",,FALSE,,activities/707175136.fit.gz
641048139,"Jul 14, 2016, 4:17:08 PM",Smithsonian Metro to Hains Point Pool & back,Run,,5056,4.24,,FALSE,,activities/707186459.tcx.gz
643265395,"Jul 16, 2016, 9:34:26 PM",Shaky McShakes. Try changing a flat 17' into 20' FTP test. I'll never be a surgeon!,Ride,,5900,42.83,45,FALSE,Felt IA4,activities/709552398.fit.gz
643322496,"Jul 16, 2016, 2:00:00 AM",Garmin fail but enjoyable shakeout ride around Cape May,Ride,,3600,30.57,,FALSE,Felt IA4,
643323609,"Jul 16, 2016, 11:28:14 PM",Easy transition run along the bay,Run,,949,3.28,,FALSE,,activities/709614850.fit.gz
643323613,"Jul 16, 2016, 12:53:46 PM",Ocean swim: 1 big loop + 4 small loops.  Refreshing!,Swim,,1951,"1,404",,FALSE,,activities/709614854.fit.gz
644593917,"Jul 17, 2016, 9:25:06 PM",Cruising the Cape w Dave B,Ride,,4980,36.41,15,FALSE,Felt IA4,activities/710977365.fit.gz
644639999,"Jul 17, 2016, 12:42:30 PM",Playing with the dolphins and teaching Dave B ocean game,Swim,,3688,"1,676",,FALSE,,activities/711023791.fit.gz
644640012,"Jul 17, 2016, 11:20:23 PM",Sunset Transition Run,Run,,1290,4.35,,FALSE,,activities/711023796.fit.gz
645643841,"Jul 18, 2016, 1:15:31 PM",Recovery swim with dolphins & waves,Swim,,1780,646,,FALSE,,activities/712095917.fit.gz
645643846,"Jul 18, 2016, 8:16:48 PM",Cruise control run to ferry & back. Crazy hot.,Run,,2609,8.18,,FALSE,,activities/712095915.fit.gz
646792692,"Jul 19, 2016, 10:04:59 PM",Feeling the flow on the mountain bike,Ride,,4398,26.38,17,FALSE,Highball,activities/713324370.fit.gz
647418748,"Jul 20, 2016, 2:16:37 PM",Easy morning commute,Ride,,2442,17.99,10,FALSE,Giant Propel Advanced 1,activities/713992506.fit.gz
647923820,"Jul 20, 2016, 9:23:27 PM",Tempo Ride Home From Work,Ride,,5180,38.66,32,FALSE,Giant Propel Advanced 1,activities/714528100.fit.gz
648759672,"Jul 21, 2016, 3:56:15 PM",Military Road Hills for Lunch.  Should've taken my inhaler. Air quality sucks,Run,,3119,9.66,,FALSE,,activities/715419697.fit.gz
649954686,"Jul 22, 2016, 8:14:24 PM",Shakeout Ride. Absorbing Cape May's Beauty,Ride,,3756,32.33,24,FALSE,Felt IA4,activities/716704213.fit.gz
650037741,"Jul 22, 2016, 9:59:33 PM","Swim with the current, against current, ride a wave, repeat",Swim,,2268,"1,547",,FALSE,,activities/716794407.fit.gz
650675554,"Jul 23, 2016, 12:00:53 PM",Super hot but fun ride with Scott and his pretty Pinarello,Ride,,8990,58.19,45,FALSE,Felt IA4,activities/717476394.fit.gz
650843874,"Jul 23, 2016, 2:55:10 PM","Stay safe out there.  During transition run, helped a cyclist that passed out due to heat",Run,,4701,4.84,,FALSE,,activities/717656741.fit.gz
652268868,"Jul 24, 2016, 1:10:11 PM",Ocean current was moving. 10 degrees colder @ the buoys. #IceCreamHeadache,Swim,,2437,"2,397",,FALSE,,activities/719192038.fit.gz
652268913,"Jul 24, 2016, 4:49:29 PM",Training the gut by running home from brunch. Chorizo was a bad idea,Run,,6379,15.07,,FALSE,,activities/719192118.fit.gz
653374870,"Jul 25, 2016, 7:11:29 PM",Recovery swim done in running shorts...aka parachute,Swim,,2238,"1,806",,FALSE,,activities/720376607.fit.gz
653388918,"Jul 25, 2016, 7:01:58 PM",Easy run to pool.  Like running through a sauna today,Run,,3440,1.62,,FALSE,,activities/720391596.tcx.gz
654324860,"Jul 26, 2016, 4:45:52 PM",Easy MTB around Arlington,Ride,,4077,15.4,,FALSE,Highball,activities/721395625.fit.gz
655354145,"Jul 27, 2016, 3:16:21 PM",Quick Ride to Work,Ride,,2316,17.97,,FALSE,Giant Propel Advanced 1,activities/722498595.fit.gz
655837414,"Jul 27, 2016, 9:36:22 PM",Seeing Chris McG in the flesh makes me push more watts,Ride,,7441,42.26,30,FALSE,Giant Propel Advanced 1,activities/723010913.fit.gz
655893450,"Jul 28, 2016, 12:00:44 AM",Transition run...need to slow down,Run,,2403,4.09,,FALSE,,activities/723070991.tcx.gz
656801947,"Jul 28, 2016, 7:15:12 PM",Aerobic swim with dash of drills/recovery,Swim,,2099,"1,829",,FALSE,,activities/724043271.fit.gz
